### ISSUE TITLE
Getting WS 7003400 into HA

### ISSUE THREAD

**Issue by Knieselhuber** [MaxensF/personal_weather_station#5]
Hello,

I tried to get my new 8in1 Wlan Bresser WS into HA but without success.
I am not a HA expert and hope you can help me.
I did the following based on your step by step documentation:
Integration PWS via HACS into HA.
Configured the WS device via WSLink. 
But nothing happened. 
I used the curl command and in HA the two entities appeared. 
Also switched destination in WSLink to PC IP and received something from WS ip in wireshark. But after switch to HA ip address, nothing happens. In WSLink I have to select an Api. Not sure if this is new. 

Hopefully you can support me in getting data into HA.

**Comment by Knieselhuber** [comment]
![Image](https://github.com/user-attachments/assets/8b1e176d-54a3-4331-b0e2-0a36e0a2800b)
![Image](https://github.com/user-attachments/assets/a6b109d3-3fbb-4a68-bad6-26511d356905)
![Image](https://github.com/user-attachments/assets/12abfee8-5b62-4278-ae3c-c26558cea722)

**Comment by MaxensF** [comment]
If it works correctly, entities should be created on your HA.

Set to your notebook IP, ol wireshark filter by the frame type (http), port, and you can add source ip (weather station IP). It's better to filter to avoid flooding.

Can weather station be in AP Mode? If yes, try to configure it by this way.

I do not use WSLink, but I don't think the battery has any influence on this.

**Comment by MaxensF** [comment]
Hi Veikko,

Thank you for the information

Can I see what was the aiohttp error?

Maxens

**Comment by Knieselhuber** [comment]
Hi,
I ask again for help because my integration is still not working and I read that Veikko  got his 7003400 bresser running.
Do you know how in detail he configured the station?

**Comment by Veikko-vataja** [comment]
The main issue is, that this station natvely uses https and can not connect to homeassistant with http. You need to open https on HA side. I changed the whole HA to use https. Regards Veikko

**Comment by Knieselhuber** [comment]
Hi Veikko,
thanks for your quick reply. 
That we are on the same page ;-).
You have also the station 7003400 Breaser 8in1 weather center heat index?
And for Configuration you use the android app and have also the firmware version 1.04?

**Comment by Veikko-vataja** [comment]
Hi. I have 7in1, but i think it does not make difference. It is quite easy to see what happens  using the tcpdump command in HA server. Install terminal on HA. You need to install tcpdump  from the terminal- migt be part of tcputities. Then use the tcpdump command in my previous comments. Try to connect from WSLink. If you see 'https used inside http ....' then the device is trying to use https and your HA interface is http. I can not see what are my specific parametrrs in WSLink app as it does not connect to my devce without beeing in AP mode. One of the worst app ever seen,😁

**Comment by Veikko-vataja** [comment]
Can't reproduce as there is no error happening in my setup. The correct command should be tcpdump -i any -A port 8123 | grep -A10 aiohttp
Will show 10 lines (A10). This is link to aoihttp https://github.com/aio-libs/aiohttp/issues/8065 
Veikko

**Comment by Knieselhuber** [comment]
Hi Veikko,
Thank you so much for your help. 
I will try to get the tcpdump working today and come back to you. 
I hope we are on the right track.

**Comment by Knieselhuber** [comment]
Hello Veikko,
as expected, I am lost :-).
I opened the terminal within my HA installed tcpdump and insert the command tcpdump -i any -A port 8123 | grep -A10 aiohttp.
On screen it appears messages but not clue what they mean or directs to an error.
Would it be somehow possible to sent you my outcome that you could have a look?

**Comment by Veikko-vataja** [comment]
Sure you can send. If there is data, it's most prpbably errors as working connection does not show anything. Veikko

**Comment by Knieselhuber** [comment]
Hi Veikko,

in the next comment I copied some terminal results which I got after running tcpdump.
But not sure if you can find something in.

**Comment by Knieselhuber** [comment]
System is ready! Use browser or app to configure.
➜  ~ bash
~ $ tcpdump -i any -A port 8123 | grep -A10 aiohttp
tcpdump: WARNING: any: That device doesn't support promiscuous mode
(Promiscuous mode not supported on the "any" device)
tcpdump: verbose output suppressed, use -v[v]... for full protocol decode
listening on any, link-type LINUX_SLL2 (Linux cooked v2), snapshot length 262144 Bytes

Invalid method encountered:

  b'\x16\x03\x03'
    ^
21:08:02.058990 enp0s18 Out IP 6c829aa581d845cd933deb94505b05fb.fritz.box.8123 > espressif.fritz.box.61164: Flags [F.], seq 216, ack 246, win 63995, length 0
E..(B(@.@.u........D....~.q.....P.......
21:08:02.075875 enp0s18 In  IP espressif.fritz.box.61164 > 6c829aa581d845cd933deb94505b05fb.fritz.box.8123: Flags [.], ack 217, win 5528, length 0
E..(.%..@......D............~.q.P.............
21:08:02.075875 enp0s18 In  IP espressif.fritz.box.61164 > 6c829aa581d845cd933deb94505b05fb.fritz.box.8123: Flags [R.], seq 246, ack 217, win 28694, length 0
--
Server: Python/3.13 aiohttp/3.12.15

Invalid method encountered:

  b'\x16\x03\x03'
    ^
21:08:03.077241 enp0s18 Out IP 6c829aa581d845cd933deb94505b05fb.fritz.box.8123 > espressif.fritz.box.61165: Flags [F.], seq 216, ack 246, win 63995, length 0
E..(..@.@..........D.....B.bo.THP.......
21:08:03.079992 enp0s18 In  IP espressif.fritz.box.61165 > 6c829aa581d845cd933deb94505b05fb.fritz.box.8123: Flags [.], ack 217, win 5528, length 0
E..(.*..@......D........o.TH.B.cP...g9........
21:08:03.145185 enp0s18 Out IP 6c829aa581d845cd933deb94505b05fb.fritz.box.8123 > DESKTOP-L5LVCHT.fritz.box.60133: Flags [P.], seq 27908:28087, ack 169, win 496, length 179

E..(....@......D.....T..........P....u........
21:09:13.017204 enp0s18 In  IP espressif.fritz.box.63060 > 6c829aa581d845cd933deb94505b05fb.fritz.box.8123: Flags [R.], seq 246, ack 217, win 28694, length 0
--
Server: Python/3.13 aiohttp/3.12.15

Invalid method encountered:

  b'\x16\x03\x03'
    ^
21:09:14.041106 enp0s18 Out IP 6c829aa581d845cd933deb94505b05fb.fritz.box.8123 > espressif.fritz.box.63061: Flags [F.], seq 216, ack 246, win 63995, length 0
E..(Gl@.@.o........D...U.K.:..sAP.......
21:09:14.043950 enp0s18 In  IP espressif.fritz.box.63061 > 6c829aa581d845cd933deb94505b05fb.fritz.box.8123: Flags [.], ack 217, win 5528, length 0
E..(."..@......D.....U....sA.K.;P.............
21:09:14.053995 enp0s18 In  IP espressif.fritz.box.63061 > 6c829aa581d845cd933deb94505b05fb.fritz.box.8123: Flags [R.], seq 246, ack 217, win 28694, length 0
--
Server: Python/3.13 aiohttp/3.12.15

Invalid method encountered:

  b'\x16\x03\x03'
    ^
21:09:15.061215 enp0s18 Out IP 6c829aa581d845cd933deb94505b05fb.fritz.box.8123 > espressif.fritz.box.63062: Flags [F.], seq 216, ack 246, win 63995, length 0
E..(+[@.@..........D...V..cQ...7P.......
21:09:15.063991 enp0s18 In  IP espressif.fritz.box.63062 > 6c829aa581d845cd933deb94505b05fb.fritz.box.8123: Flags [.], ack 217, win 5528, length 0
E..(.'..@..     ...D.....V.....7..cRP.............
21:09:15.252873 enp0s18 Out IP 6c829aa581d845cd933deb94505b05fb.fritz.box.8123 > DESKTOP-L5LVCHT.fritz.box.60133: Flags [P.], seq 40489:40718, ack 262, win 496, length 229

E..(....@......D............`N..P....$........
21:10:10.405771 enp0s18 In  IP espressif.fritz.box.49538 > 6c829aa581d845cd933deb94505b05fb.fritz.box.8123: Flags [R.], seq 246, ack 217, win 28694, length 0
--
Server: Python/3.13 aiohttp/3.12.15

Invalid method encountered:

  b'\x16\x03\x03'
    ^
21:10:11.415157 enp0s18 Out IP 6c829aa581d845cd933deb94505b05fb.fritz.box.8123 > espressif.fritz.box.49539: Flags [F.], seq 216, ack 246, win 63995, length 0
E..(7I@.@..........D......[..4..P.......
21:10:11.418002 enp0s18 In  IP espressif.fritz.box.49539 > 6c829aa581d845cd933deb94505b05fb.fritz.box.8123: Flags [.], ack 217, win 5528, length 0
E..(.#..@......D.........4....[.P...S.........
21:10:11.426238 enp0s18 In  IP espressif.fritz.box.49539 > 6c829aa581d845cd933deb94505b05fb.fritz.box.8123: Flags [R.], seq 246, ack 217, win 28694, length 0
--
Server: Python/3.13 aiohttp/3.12.15

Invalid method encountered:

  b'\x16\x03\x03'
    ^
21:10:12.439091 enp0s18 Out IP 6c829aa581d845cd933deb94505b05fb.fritz.box.8123 > espressif.fritz.box.49541: Flags [F.], seq 216, ack 246, win 63995, length 0
E..(..@.@..W.......D........,}..P.......
21:10:12.442198 enp0s18 In  IP espressif.fritz.box.49541 > 6c829aa581d845cd933deb94505b05fb.fritz.box.8123: Flags [.], ack 217, win 5528, length 0
E..(.*..@......D........,}......P.............

**Comment by Veikko-vataja** [comment]
Server: Python/3.13 aiohttp/3.12.15
Invalid method encountered:
b'\x16\x03\x03'

If your HA is configured to use http, i think the case is https traffic in http port. Some versions of aiohttp are more clear in error messages as i got it clearly written. I could not change the WS to use http - my WS modell uses https so only way was to change HA to  https and voila.
It might be also something a bit different as in this case : https://community.home-assistant.io/t/aiohttp-server-error-cause/627951  but still related to http/https. You can find several cases googling Invalid method encountered: b'\x16\x03\x03'

**Comment by Knieselhuber** [comment]
Hello Veikko,
first I want to thank you again for your time you support me!

Based on your investigations so far what could be the next steps.
Does the solution could be to enable https?
What would be the easiest way to get it available.

**Comment by Veikko-vataja** [comment]
Hi.
I think going to https is the way forward - anyway it's no waste of efforts for the future. There are plenty of instructions. Certificates and creating those are not easy understandable at leas for me. I installed both DuckDNS and Let's Encrypt even i had all ready NoIP dyndns service in use. I felt DuckDNS helps with certificates creation. I dont have NGINX. Here is one with using only Let's Encrypt https://theprivatesmarthome.com/how-to/enable-https-using-lets-encrypt-in-home-assistant/

**Comment by Knieselhuber** [comment]
Hi Veikko,
I configured https on my HA.
My HA is now external accessable  via https://dns-name.ts.net from.
Via my internal IP further via http.

How should I confugure the weather station via wslink?
- Internal IP:8123 or
- dns-name.ts.net:8123?
Random Station Name
Stadion ID blank
API WSlink or Wunderground?

Thanks in advance

**Comment by Knieselhuber** [comment]
Hi Veikko, MaxensF,
I can confirm, that the weather station 7003400 is working with your Integration;-)!!
After configuration of my HA for https, I configured my station like you described for https.
Now I received the station name and all entities of the weather station.
Thank you both for the Integration and detailed support in my case / station.
